{
    "schema_version": "1.0",
    "manifest_id": "SAGE-COMP-20260801-004",
    "request": "Activate the complete Kalaxy3 SAGE mandatory operating contract. Require current Git, GitHub, SAGE, and runtime authority before mutation; evidence-based selection and reuse of repository-owned components; composition manifests; capability-gap receipts; real runtime validation; failure diagnosis that records what failed, what should have been done, which existing component should have been used, why the actual path differed, and the reusable correction; measurable outcome, reuse, authority, failure, rework, and safety statistics; Git credential and history safety; and an operator-executed, visible, one-boundary-at-a-time Git/GitHub mutation gate. Downloaded implementation helpers may edit and validate repository files but may only inspect Git read-only and may not create or switch branches, stage, commit, push, pull, merge, rebase, reset, clean, delete refs, mutate GitHub, or deploy.",
    "created_at": "2026-08-01T22:55:00-05:00",
    "authority_receipt": "artifact:kalaxy3-sage-operating-contract-authority-20260801-211530.json#sha256=e1b08b7e5a6dee4205269f47baffd15ca63866cfa8263cecb79f17b9f88c9974",
    "required_capabilities": [
        {
            "capability_id": "CAP-010",
            "description": "Enforce the operating contract through repository-root policy, Make entry points, and guardrails.",
            "required": true
        },
        {
            "capability_id": "CAP-011",
            "description": "Compose the complete repository-content and operator-verification sequence from existing versioned primitives without a new mutation engine.",
            "required": true
        },
        {
            "capability_id": "CAP-012",
            "description": "Prove positive, negative, fail-closed, source, and runtime behavior in the root guardrail chain.",
            "required": true
        },
        {
            "capability_id": "CAP-013",
            "description": "Preserve implementation readiness for split SAGE evidence publication after the implementation commit is known.",
            "required": true
        }
    ],
    "candidates": [
        {
            "candidate_id": "CANDIDATE-119",
            "capability_ids": [
                "CAP-010"
            ],
            "component_id": "repository-root-policy",
            "version": "1.0.0",
            "source_path": "AGENTS.md; SAGE.md; Makefile; sage-operating-contract-policy.json",
            "maturity": "pilot",
            "disposition": "selected",
            "selection_factors": {
                "applicability": "direct",
                "authority_compatibility": "compatible",
                "mutation_scope_fit": "least-authority",
                "published_interface_verified": true,
                "successful_production_executions": null,
                "failed_production_executions": null,
                "open_recurrence": "no",
                "runtime_test_coverage": "positive-and-negative"
            },
            "evidence_references": [
                "commit-prefix:219d116",
                "path:markdown/standards/kalaxy3-sage-operating-contract.md"
            ],
            "rationale": "Existing repository-root policy and Make integration are the narrowest sufficient enforcement surface."
        },
        {
            "candidate_id": "CANDIDATE-120",
            "capability_ids": [
                "CAP-011"
            ],
            "component_id": "workflow.composition",
            "version": "1.1.0",
            "source_path": "scripts/sage/workflow/composition.py",
            "maturity": "pilot",
            "disposition": "selected",
            "selection_factors": {
                "applicability": "direct",
                "authority_compatibility": "compatible",
                "mutation_scope_fit": "least-authority",
                "published_interface_verified": true,
                "successful_production_executions": null,
                "failed_production_executions": null,
                "open_recurrence": "no",
                "runtime_test_coverage": "positive-and-negative"
            },
            "evidence_references": [
                "path:sage-workflow-primitives.json",
                "path:scripts/sage/workflow/composition.py"
            ],
            "rationale": "The registered workflow composition primitive can order the nine approved primitives and preserve the operator boundary."
        },
        {
            "candidate_id": "CANDIDATE-121",
            "capability_ids": [
                "CAP-012"
            ],
            "component_id": "validation.plan",
            "version": "1.0.0",
            "source_path": "scripts/sage/workflow/validation.py",
            "maturity": "pilot",
            "disposition": "selected",
            "selection_factors": {
                "applicability": "direct",
                "authority_compatibility": "compatible",
                "mutation_scope_fit": "least-authority",
                "published_interface_verified": true,
                "successful_production_executions": null,
                "failed_production_executions": null,
                "open_recurrence": "no",
                "runtime_test_coverage": "positive-and-negative"
            },
            "evidence_references": [
                "path:scripts/sage/sage-workflow-primitives-self-test.py",
                "path:scripts/sage/sage-git-safety-guardrail.py"
            ],
            "rationale": "Existing validation and safety guardrails cover source, runtime, negative, and fail-closed paths."
        },
        {
            "candidate_id": "CANDIDATE-122",
            "capability_ids": [
                "CAP-013"
            ],
            "component_id": "evidence.closeout",
            "version": "1.1.0",
            "source_path": "scripts/sage/workflow/evidence.py",
            "maturity": "pilot",
            "disposition": "selected",
            "selection_factors": {
                "applicability": "direct",
                "authority_compatibility": "compatible",
                "mutation_scope_fit": "least-authority",
                "published_interface_verified": true,
                "successful_production_executions": null,
                "failed_production_executions": null,
                "open_recurrence": "no",
                "runtime_test_coverage": "positive-and-negative"
            },
            "evidence_references": [
                "path:scripts/sage/sage-evidence-orchestrator.py",
                "path:scripts/sage/sage-publish.py"
            ],
            "rationale": "The existing closeout, orchestrator, publisher, and indexer support split evidence publication after the implementation SHA exists."
        },
        {
            "candidate_id": "CANDIDATE-123",
            "capability_ids": [
                "CAP-010",
                "CAP-011",
                "CAP-012",
                "CAP-013"
            ],
            "component_id": "operating-contract.mutation-engine",
            "version": "not-created",
            "source_path": "not-applicable",
            "maturity": "unregistered",
            "disposition": "rejected",
            "selection_factors": {
                "applicability": "partial",
                "authority_compatibility": "compatible",
                "mutation_scope_fit": "broader-than-required",
                "published_interface_verified": false,
                "successful_production_executions": 0,
                "failed_production_executions": 0,
                "open_recurrence": "unknown",
                "runtime_test_coverage": "none"
            },
            "evidence_references": [
                "path:markdown/standards/kalaxy3-sage-operating-contract.md"
            ],
            "rationale": "A new autonomous engine would duplicate existing primitives and violate the operator-executed mutation boundary."
        }
    ],
    "selections": [
        {
            "capability_id": "CAP-010",
            "candidate_id": "CANDIDATE-119",
            "component_id": "repository-root-policy",
            "version": "1.0.0",
            "selection_basis": "Root policy and Make integration are sufficient without a new primitive."
        },
        {
            "capability_id": "CAP-011",
            "candidate_id": "CANDIDATE-120",
            "component_id": "workflow.composition",
            "version": "1.1.0",
            "selection_basis": "Existing composition preserves order and the split operator boundary."
        },
        {
            "capability_id": "CAP-012",
            "candidate_id": "CANDIDATE-121",
            "component_id": "validation.plan",
            "version": "1.0.0",
            "selection_basis": "Existing validation and safety components supply positive and negative runtime coverage."
        },
        {
            "capability_id": "CAP-013",
            "candidate_id": "CANDIDATE-122",
            "component_id": "evidence.closeout",
            "version": "1.1.0",
            "selection_basis": "Existing evidence components support a split evidence commit after implementation."
        }
    ],
    "composition": [
        {
            "sequence": 1,
            "step_id": "preserve-literal-request",
            "capability_id": "CAP-011",
            "component_id": "sage.discovery",
            "version": "1.0.0",
            "purpose": "preserve literal request",
            "side_effect_scope": "read-only"
        },
        {
            "sequence": 2,
            "step_id": "collect-current-git-authority",
            "capability_id": "CAP-011",
            "component_id": "git.inspect",
            "version": "1.0.0",
            "purpose": "collect current git authority",
            "side_effect_scope": "read-only"
        },
        {
            "sequence": 3,
            "step_id": "reconcile-authority",